title,url,thumbnail_url,channel,description,views,uploaded
I Spent 100 Days in Realistic Minecraft,https://www.youtube.com/watch?v=OHbKGR7N1iI,https://i.ytimg.com/vi/OHbKGR7N1iI/hqdefault.jpg?sqp=-oaymwEcCPYBEIoBSFXyq4qpAw4IARUAAIhCGAFwAcABBg==&rs=AOn4CLAAIH8xfEk_Q4nvN6JHj6fH9srJjA,Ryan Trahan,FREE JOSEPH Buy a Roborock - https://cli.fm/Roborock-S7dock-RyanTrahan-YT Buy a Roborock (Amazon) - https://cli.fm/Roborock-S7dock-RyanTrahan-YT-Amazon Hope u enjoy this movie,1.6M views,23 hours ago
Juice WRLD - Burn (Official Music Video),https://www.youtube.com/watch?v=HA1srD2DwaI,https://i.ytimg.com/vi/HA1srD2DwaI/hqdefault.jpg?sqp=-oaymwEcCPYBEIoBSFXyq4qpAw4IARUAAIhCGAFwAcABBg==&rs=AOn4CLAyEgqvbTU2ErDAdtIGF6qWSWhZAQ,Juice WRLD,"Juice WRLD ""Fighting Demons"" is available now: https://JuiceWrld.lnk.to/FightingDemons Directed by Steve Cannon Produced by Grade A Films Subscribe to the official Juice WRLD channel for new...",2.2M views,1 day ago
"Sonic the Hedgehog 2 (2022) - ""Official Trailer"" - Paramount Pictures",https://www.youtube.com/watch?v=G5kzUpWAusI,https://i.ytimg.com/vi/G5kzUpWAusI/hqdefault.jpg?sqp=-oaymwEcCPYBEIoBSFXyq4qpAw4IARUAAIhCGAFwAcABBg==&rs=AOn4CLAW3kIDRvhvVU_RLVMuLqLlBUVzcg,Paramount Pictures,"The world’s favorite blue hedgehog is back for a next-level adventure in SONIC THE HEDGEHOG 2. After settling in Green Hills, Sonic is eager to prove he has what it takes to be a true hero....",7.4M views,1 day ago
Star Wars Eclipse – Official Cinematic Reveal Trailer,https://www.youtube.com/watch?v=4cJpiOPKH14,https://i.ytimg.com/vi/4cJpiOPKH14/hqdefault.jpg?sqp=-oaymwEcCPYBEIoBSFXyq4qpAw4IARUAAIhCGAFwAcABBg==&rs=AOn4CLCzc5ZoRVo00jZJyInW55CErkw7UA,Star Wars,"Star Wars Eclipse™ is the newest adventure in the High Republic era, now early in development by Quantic Dream. Learn more on www.StarWarsEclipse.com. Set during the High Republic era,...",4.1M views,1 day ago
Hotboii ft. 42 Dugg & Moneybagg Yo - I Really (Official Video),https://www.youtube.com/watch?v=dhwvev7Tdp0,https://i.ytimg.com/vi/dhwvev7Tdp0/hqdefault.jpg?sqp=-oaymwEcCPYBEIoBSFXyq4qpAw4IARUAAIhCGAFwAcABBg==&rs=AOn4CLAIg7ZlEDj7ix_sT96vXb3jDF9kcw,H O T B O I I,"Stream ""Life Of A Hotboii"" here: https://Hotboii.lnk.to/LifeOfAHotboii Shot by: @DrewFilmedIt Follow Hotboii on Instagram: https://www.instagram.com/itshotboii438 Twitter: https://twitter.com...",510K views,23 hours ago
Tom Holland Calls for a Doctor While Eating Spicy Wings | Hot Ones,https://www.youtube.com/watch?v=qxGmGGmvFD8,,First We Feast,"Tom Holland began his career at 12 years old in the West End production of Billy Elliot, and now he's one of Hollywood's biggest box office draws, from award-winning performances in The Impossible,...",4.3M views,2 days ago
He Owns The Moon,https://www.youtube.com/shorts/xyy9rqkEwc0,,Nas Daily,#shorts,2.4M views,1 day ago
OUR NEW HOUSE TOUR! *EXCLUSIVE*,https://www.youtube.com/watch?v=RsdGGeDWl_Q,,The ACE Family,OUR NEW HOUSE TOUR! *EXCLUSIVE* **ACE FAMILY MERCH HERE: shopacefamily.com LAST VIDEO: https://www.youtube.com/watch?v=xkhq3T6aw6Q&t=785s JOIN THE ACE FAMILY & SUBSCRIBE: http://bit.ly/THEACEFAM...,2M views,1 day ago
A Conversation with Travis Scott and Charlamagne Tha God,https://www.youtube.com/watch?v=FS9SvGvbSgw,,CThaGod,"Charlamagne Tha God and Travis Scott in his first interview since the tragedies at the Astroworld Festival. During this open conversation, Scott goes in depth about the events that occurred...",1.4M views,2 days ago
"""I bumped into Tobey 20 minutes later!"" Tom Holland and Zendaya on the Spider-Man WhatsApp group 🕷",https://www.youtube.com/watch?v=zWEqZDPqRjI,,BBC Radio 1,"Watch Tom and Zendaya's chat with Ali in full on BBC iPlayer in the UK: https://bbc.in/3rOThNW Tom Holland and Zendaya join BBC Radio 1's film critic Ali Plumb to talk about new Marvel movie,...",1M views,1 day ago
